{
  "application_id": "app_synthetic",
  "build_id": "build_synthetic",
  "build_identity_digest": "sha256:53effba69a9d01818c4bf41763e97833cc3dc46ab45c9fd7a1e027b8e1707c91",
  "capture_scope": "app_only",
  "consent": {
    "diagnostics": "granted",
    "granted_at": "2026-07-21T09:56:00Z",
    "microphone": "granted",
    "policy_version": "tacua.consent-v1",
    "raw_media_upload": "granted",
    "screen_recording": "granted"
  },
  "message_type": "capture_scope",
  "organization_id": "org_synthetic",
  "project_id": "project_synthetic",
  "protocol_version": "tacua.sdk-backend@1.0.0",
  "retention": {
    "derived_data_days": 30,
    "policy_version": "tacua.retention-v1",
    "raw_media_days": 30
  },
  "scope_digest": "sha256:c38600d56cdb3bc8a0d94c0dd7e6323f863d1ccbc6953b6c71421e7c08512a20"
}
